{
  "id": "deploy_docs_preview",
  "name": "Documentation Preview",
  "status": "draft",
  "environmentId": "env_preview",
  "purpose": "Preview repository documentation and generated artifacts before release.",
  "releaseGate": [
    "npm run check:all passes",
    "Release checklist is updated",
    "No secrets are present"
  ],
  "rollback": "Destroy preview and return to the last passing repository state."
}
